show_id,type,title,director,country,date_added,release_year,rating,duration,listed_in
s2888,Movie,Full Count,Robert Eagar,United States,2/23/2020,2019,TV-PG,110 min,"Children & Family Movies, Dramas, Faith & Spirituality"
s2890,Movie,Girl on the Third Floor,Travis Stevens,United States,2/22/2020,2019,TV-MA,92 min,Horror Movies
s2891,TV Show,Unabomber - In His Own Words,Mick Grogan,Canada,2/22/2020,2018,TV-MA,1 Season,"Crime TV Shows, Docuseries"
s2896,Movie,System Crasher,Nora Fingscheidt,Germany,2/21/2020,2020,TV-MA,120 min,"Dramas, Independent Movies, International Movies"
s2897,Movie,The Body,Jeethu Joseph,India,2/21/2020,2019,TV-14,101 min,"International Movies, Thrillers"
s2898,Movie,The Last Thing He Wanted,Dee Rees,United States,2/21/2020,2020,R,116 min,"Dramas, Thrillers"
s2899,Movie,Yeh Ballet,Sooni Taraporevala,India,2/21/2020,2020,TV-MA,117 min,"Dramas, International Movies"
s2900,Movie,Pretville,Linda Korsten,South Africa,2/20/2020,2012,TV-PG,95 min,"Comedies, International Movies, Music & Musicals"
s2902,Movie,Untamed Romania,Tom Barton-Humphreys,Romania,2/20/2020,2018,TV-PG,93 min,"Children & Family Movies, Documentaries, International Movies"
s2904,Movie,By the Sea,Angelina Jolie,France,2/16/2020,2015,R,122 min,"Dramas, Romantic Movies"
s2905,Movie,Miss Virginia,R.J. Daniel Hanna,United States,2/16/2020,2019,TV-MA,102 min,"Dramas, Independent Movies"
s2906,Movie,MR. RIGHT,Paco Cabezas,United States,2/16/2020,2015,R,96 min,"Action & Adventure, Comedies, Romantic Movies"
s2907,TV Show,On the Real,Tosin Coker,Nigeria,2/16/2020,2017,TV-MA,1 Season,"International TV Shows, TV Dramas"
s2908,Movie,Term Life,Peter Billingsley,United States,2/16/2020,2016,R,93 min,"Dramas, Thrillers"
s2909,Movie,The Forest,Jason Zada,United States,2/16/2020,2016,PG-13,93 min,"Horror Movies, Independent Movies"
s2910,Movie,Monster High: Electrified,Avgousta Zourelidi,Not Given,2/15/2020,2017,TV-Y,72 min,Movies
s2912,Movie,A Shaun the Sheep Movie: Farmageddon,"Richard Phelan, Will Becher",United Kingdom,2/14/2020,2019,G,87 min,"Children & Family Movies, Comedies"
s2913,Movie,Cuddle Weather,Rod Cabatana Marmol,Philippines,2/14/2020,2019,TV-MA,95 min,"Dramas, International Movies, Romantic Movies"
s2914,Movie,Fanatyk,Michał Tylka,Poland,2/14/2020,2017,TV-MA,33 min,"Comedies, Dramas, Independent Movies"
s2915,Movie,Isi & Ossi,Oliver Kienle,Germany,2/14/2020,2020,TV-MA,113 min,"Comedies, International Movies, Romantic Movies"
s2916,Movie,Liefling,Brian Webber,South Africa,2/14/2020,2010,TV-PG,118 min,"Comedies, International Movies, Music & Musicals"
s2917,Movie,Panipat - The Great Betrayal,Ashutosh Gowariker,India,2/14/2020,2019,TV-14,171 min,"Dramas, International Movies, Romantic Movies"
s2919,Movie,The Ghost and the Tout,Charles Uwagbai,Nigeria,2/14/2020,2018,TV-14,100 min,"Comedies, International Movies"
s2920,Movie,Dragon Quest Your Story,"Takashi Yamazaki, Ryuichi Yagi, Makoto Hanafusa",Japan,2/13/2020,2019,TV-PG,103 min,"Action & Adventure, Anime Features, Children & Family Movies"
s2924,TV Show,Sleepless Society: Insomnia,"Pantham Thongsang, Cheewatan Pusitsuksa",Thailand,2/13/2020,2019,TV-MA,1 Season,"Crime TV Shows, International TV Shows, TV Dramas"
s2925,Movie,French Toast,"Paul Krüger, Anél Stolp",South Africa,2/12/2020,2015,TV-PG,86 min,"Comedies, International Movies, Romantic Movies"
s2926,Movie,To All the Boys: P.S. I Still Love You,Michael Fimognari,United States,2/12/2020,2020,TV-14,102 min,"Comedies, Romantic Movies"
s2929,Movie,Good Time,"Benny Safdie, Josh Safdie",United States,2/11/2020,2017,R,101 min,"Dramas, Independent Movies, Thrillers"
s2930,Movie,ROAD TO ROMA,Andres Clariond,Mexico,2/11/2020,2020,TV-PG,73 min,"Documentaries, International Movies"
s2931,Movie,Love for Sale 2,Andibachtiar Yusuf,Indonesia,2/10/2020,2019,TV-14,96 min,"Dramas, International Movies, Romantic Movies"
s2933,Movie,Fronteras,Andrew Dean,United States,2/9/2020,2018,TV-MA,106 min,"Dramas, Independent Movies, Thrillers"
s2934,Movie,Polaroid,Lars Klevberg,United States,2/9/2020,2019,PG-13,88 min,Horror Movies
s2935,Movie,The Coldest Game,Lukasz Kosmicki,Poland,2/8/2020,2019,TV-MA,103 min,"Dramas, International Movies, Thrillers"
s2936,Movie,Thottappan,Shanavas K. Bavakutty,India,2/8/2020,2019,TV-14,139 min,"Comedies, Dramas, International Movies"
s2937,Movie,Azali,Kwabena Gyansah,Ghana,2/7/2020,2018,TV-14,89 min,"Dramas, International Movies"
s2940,Movie,Horse Girl,Jeff Baena,United States,2/7/2020,2020,R,104 min,"Dramas, Independent Movies"
s2941,Movie,Jada,Kumaran,India,2/7/2020,2019,TV-14,124 min,"Dramas, International Movies, Sports Movies"
s2947,Movie,Gardeners of Eden,"Austin Peck, Anneliese Vandenberg",Kenya,2/6/2020,2014,TV-14,70 min,Documentaries
s2948,TV Show,Arrow,James Bamford,United States,2/5/2020,2019,TV-14,8 Seasons,"Crime TV Shows, TV Action & Adventure"
s2949,TV Show,The Pharmacist,"Julia Willoughby Nason, Jenner Furst",United States,2/5/2020,2020,TV-MA,1 Season,"Crime TV Shows, Docuseries"
s2950,Movie,Uppity: The Willy T. Ribbs Story,"Nate Adams, Adam Carolla",United States,2/5/2020,2020,TV-MA,106 min,"Documentaries, Sports Movies"
s2951,Movie,Dragonheart: Vengeance,Ivan Silvestrini,United States,2/4/2020,2020,PG-13,97 min,"Action & Adventure, Sci-Fi & Fantasy"
s2952,Movie,"Faith, Hope & Love",Robert Krantz,United States,2/4/2020,2019,PG,106 min,"Comedies, Faith & Spirituality, Romantic Movies"
s2953,Movie,Tom Papa: You're Doing Great!,Gregory Jacobs,United States,2/4/2020,2020,TV-14,60 min,Stand-Up Comedy
s2955,Movie,Thambi,Jeethu Joseph,India,2/3/2020,2019,TV-14,148 min,"International Movies, Thrillers"
s2956,Movie,The Silent War,Alfonso Cortés-Cavanillas,Spain,2/3/2020,2020,TV-MA,122 min,"Dramas, International Movies, Thrillers"
s2957,Movie,Chronically Metropolitan,Xavier Manrique,United States,2/1/2020,2016,TV-MA,86 min,"Comedies, Dramas, Independent Movies"
s2958,Movie,Hum Aapke Hain Koun,Sooraj R. Barjatya,India,2/1/2020,1994,TV-14,193 min,"Classic Movies, Dramas, International Movies"
s2961,Movie,Justice,Richard Gabai,United States,2/1/2020,2017,R,92 min,Movies
s2962,Movie,Love Jacked,Alfons Adetuyi,Canada,2/1/2020,2018,PG-13,94 min,"Comedies, International Movies, Romantic Movies"
s2963,TV Show,Miraculous: Tales of Ladybug & Cat Noir,Thomas Astruc,France,2/1/2020,2019,TV-Y7,5 Seasons,"Kids' TV, TV Action & Adventure"
s2964,Movie,Misfit 2,Erwin van den Eshof,Netherlands,2/1/2020,2019,TV-G,82 min,"Children & Family Movies, Comedies, International Movies"
s2969,Movie,The Car: Road to Revenge,G.J. Echternkamp,United States,2/1/2020,2019,TV-MA,89 min,"Action & Adventure, Horror Movies, Sci-Fi & Fantasy"
s2970,Movie,Together For Eternity,Sooraj R. Barjatya,India,2/1/2020,1999,TV-G,176 min,"Dramas, International Movies, Music & Musicals"
s2971,Movie,37 Seconds,Hikari,Japan,1/31/2020,2020,TV-MA,116 min,"Dramas, International Movies"
s2973,Movie,Gang of the Caribbean,Jean-Claude Flamand-Barny,France,1/31/2020,2016,TV-MA,86 min,"Dramas, International Movies"
s2974,Movie,Hakkunde,Oluseyi Asurf,Nigeria,1/31/2020,2017,TV-14,93 min,"Comedies, Dramas, Independent Movies"
s2976,Movie,Miss Americana,Lana Wilson,United States,1/31/2020,2020,TV-MA,85 min,"Documentaries, Music & Musicals"
s2979,Movie,Kevin Hart: I'm a Grown Little Man,Shannon Hartman,United States,1/30/2020,2009,TV-MA,62 min,Stand-Up Comedy
s2982,Movie,Close Enemies,David Oelhoffen,France,1/29/2020,2018,TV-MA,112 min,"Dramas, International Movies"
s2986,Movie,Shimla Mirchi,Ramesh Sippy,India,1/27/2020,2020,TV-14,121 min,"Comedies, International Movies, Romantic Movies"
s2987,Movie,Sillu Karuppatti,Halitha Shameem,India,1/26/2020,2019,TV-14,133 min,"Comedies, Dramas, Independent Movies"
s2988,Movie,Vir Das: For India,"Vir Das, Ajay Bhuyan",India,1/26/2020,2020,TV-MA,76 min,Stand-Up Comedy
s2989,Movie,Menashe,"Josh Z. Weinstein, Joshua Z. Weinstein",United States,1/25/2020,2017,PG,82 min,"Dramas, Independent Movies"
s2990,Movie,A Sun,Chung Mong-hong,Taiwan,1/24/2020,2019,TV-MA,156 min,"Dramas, Independent Movies, International Movies"
s2991,Movie,Die Ontwaking,Johnny Breedt,South Africa,1/24/2020,2015,TV-MA,90 min,"International Movies, Thrillers"
s2996,Movie,Airplane Mode,César Rodrigues,United States,1/23/2020,2020,TV-PG,97 min,"Comedies, International Movies, Romantic Movies"
s2997,Movie,Alex Fernández: The Best Comedian in the World,Alex Díaz,Mexico,1/23/2020,2020,TV-MA,51 min,Stand-Up Comedy
s3000,TV Show,The Ghost Bride,Quek Shio-chuan,Taiwan,1/23/2020,2020,TV-14,1 Season,"International TV Shows, TV Dramas, TV Mysteries"
s3003,Movie,Whisky,"Pablo Stoll, Juan Pablo Rebella",Uruguay,1/22/2020,2004,TV-MA,98 min,"Comedies, Dramas, International Movies"
s3004,Movie,Fortune Feimster: Sweet & Salty,Krysia Plonka,United States,1/21/2020,2020,TV-MA,61 min,Stand-Up Comedy
s3005,Movie,KD (A) Karuppudurai,Madhumita,India,1/21/2020,2019,TV-14,116 min,"Comedies, Dramas, Independent Movies"
s3007,Movie,Motichoor Chaknachoor,Debamitra Biswal,India,1/20/2020,2019,TV-14,132 min,"Comedies, Dramas, International Movies"
s3008,Movie,WHAT DID JACK DO?,David Lynch,United States,1/20/2020,2020,TV-14,17 min,"Dramas, Independent Movies"
s3009,Movie,The Bling Ring,Sofia Coppola,United States,1/18/2020,2013,R,91 min,"Dramas, Independent Movies"
s3010,Movie,A Fall from Grace,Tyler Perry,United States,1/17/2020,2020,TV-MA,121 min,"Dramas, Thrillers"
s3015,Movie,Deadcon,Caryn Waechter,United States,1/16/2020,2019,TV-14,78 min,Horror Movies
s3017,Movie,Hop,Tim Hill,United States,1/16/2020,2011,PG,95 min,"Children & Family Movies, Comedies"
s3018,Movie,Jezebel,Numa Perrier,United States,1/16/2020,2019,TV-MA,86 min,"Dramas, Independent Movies"
s3019,Movie,Legend,Brian Helgeland,United Kingdom,1/16/2020,2015,R,132 min,"Dramas, International Movies, Thrillers"
s3020,Movie,NiNoKuni,Yoshiyuki Momose,Japan,1/16/2020,2019,TV-14,107 min,"Action & Adventure, Anime Features, Children & Family Movies"
s3022,Movie,Steve Jobs,Danny Boyle,United Kingdom,1/16/2020,2015,R,122 min,Dramas
s3023,Movie,Bulbul Can Sing,Rima Das,India,1/15/2020,2018,TV-14,95 min,"Dramas, Independent Movies, International Movies"
s3024,Movie,Eye For An Eye,Paco Plaza,Spain,1/15/2020,2019,TV-MA,108 min,"Dramas, International Movies, Thrillers"
s3026,Movie,MindGamers,Andrew Goth,Austria,1/15/2020,2017,R,99 min,"International Movies, Sci-Fi & Fantasy, Thrillers"
s3027,Movie,The Brave,William Kaufman,United States,1/15/2020,2019,TV-MA,103 min,"Action & Adventure, Independent Movies"
s3028,Movie,Leslie Jones: Time Machine,"David Benioff, D.B. Weiss",United States,1/14/2020,2020,TV-MA,66 min,Stand-Up Comedy
s3030,Movie,Women of Mafia 2,Patryk Vega,Poland,1/14/2020,2019,TV-MA,132 min,"Action & Adventure, Dramas, International Movies"
s3032,Movie,Betty White: First Lady of Television,Steve Boettcher,United States,1/12/2020,2018,TV-14,56 min,Documentaries
s3033,Movie,Made in China,Mikhil Musale,India,1/12/2020,2019,TV-MA,128 min,"Comedies, Dramas, International Movies"
s3037,TV Show,Jamtara - Sabka Number Ayega,Soumendra Padhi,India,1/10/2020,2020,TV-MA,1 Season,"Crime TV Shows, International TV Shows, TV Dramas"
s3039,Movie,Monsters: Dark Continent,Tom Green,United Kingdom,1/10/2020,2014,R,119 min,"Action & Adventure, Dramas, Independent Movies"
s3042,Movie,Bulletproof 2,Don Michael Paul,United States,1/9/2020,2020,TV-MA,97 min,"Action & Adventure, Comedies"
s3044,Movie,A Ghost Story,David Lowery,United States,1/7/2020,2017,R,92 min,"Dramas, Independent Movies"
s3045,Movie,"Live Twice, Love Once",Maria Ripoll,Spain,1/7/2020,2020,TV-MA,102 min,"Comedies, Dramas, International Movies"
s3047,Movie,All the Freckles in the World,Yibrán Asuad,Mexico,1/3/2020,2020,TV-14,90 min,"Comedies, International Movies, Romantic Movies"
s3049,Movie,Half Girlfriend,Mohit Suri,India,1/2/2020,2017,TV-14,129 min,"Dramas, International Movies, Romantic Movies"
s3052,Movie,Aruna & Her Palate,Edwin,Indonesia,1/1/2020,2018,TV-14,106 min,"Dramas, International Movies"
s3055,Movie,Breaking the Bank,Vadim Jean,United Kingdom,1/1/2020,2014,TV-PG,105 min,"Comedies, International Movies"
s3058,Movie,Garfield Gets Real,"Mark A.Z. Dippé, Kyung Ho Lee",United States,1/1/2020,2007,TV-Y,78 min,"Children & Family Movies, Comedies"
s3059,Movie,Garfield's Fun Fest,"Mark A.Z. Dippé, Eondeok Han",United States,1/1/2020,2008,TV-Y7,79 min,"Children & Family Movies, Comedies"
s3060,Movie,Garfield's Pet Force,Mark A.Z. Dippé,South Korea,1/1/2020,2009,G,78 min,"Children & Family Movies, Comedies"
s3061,Movie,Ghost Stories,"Anurag Kashyap, Dibakar Banerjee, Karan Johar, Zoya Akhtar",India,1/1/2020,2020,TV-MA,145 min,"Horror Movies, International Movies, Thrillers"
s3062,Movie,Jeff Dunham: Unhinged in Hollywood,Michael Simon,United States,1/1/2020,2015,TV-MA,71 min,Stand-Up Comedy
s3063,Movie,Jimmy Neutron: Boy Genius,John A. Davis,United States,1/1/2020,2001,G,83 min,"Children & Family Movies, Comedies, Sci-Fi & Fantasy"
s3065,Movie,Luccas Neto in: Children's Day,Lucas Margutti,Brazil,1/1/2020,2019,TV-G,81 min,"Children & Family Movies, Comedies, Music & Musicals"
s3073,Movie,Riot,John Lyde,Not Given,1/1/2020,2015,TV-MA,88 min,Action & Adventure
s3068,TV Show,"Nisman: The Prosecutor, the President, and the Spy",Justin Webster,Spain,1/1/2020,2020,TV-MA,1 Season,"Crime TV Shows, Docuseries, International TV Shows"
s3069,Movie,Pan's Labyrinth,Guillermo del Toro,Mexico,1/1/2020,2006,R,119 min,"Dramas, International Movies, Sci-Fi & Fantasy"
s3070,Movie,Pokémon the Movie: Power of Us,Tetsuo Yajima,Japan,1/1/2020,2018,TV-Y7,98 min,"Anime Features, Children & Family Movies"
s3071,Movie,Posesif,Edwin,Indonesia,1/1/2020,2017,TV-MA,102 min,"Dramas, International Movies, Romantic Movies"
s3074,Movie,Road Trip: Beer Pong,Steve Rash,United States,1/1/2020,2009,R,97 min,Comedies
s3078,Movie,Aaviri,Ravi Babu,India,12/31/2019,2019,TV-14,110 min,"Horror Movies, International Movies, Thrillers"
s3079,Movie,Albert Pinto Ko Gussa Kyun Aata Hai?,Soumitra Ranade,India,12/31/2019,2019,TV-MA,85 min,"Dramas, Independent Movies, International Movies"
s3081,Movie,Benchwarmers 2: Breaking Balls,Jon Rosenbaum,United States,12/31/2019,2019,PG-13,90 min,"Comedies, Sports Movies"
s3082,Movie,How High 2,Bruce Leddy,United States,12/31/2019,2019,TV-MA,89 min,Comedies
s3094,Movie,The Vendor,Odunlade Adekola,Not Given,12/27/2019,2018,TV-MA,103 min,"Comedies, International Movies"
s3090,Movie,Hot Gimmick: Girl Meets Boy,Yuki Yamato,Japan,12/28/2019,2019,TV-MA,120 min,"Dramas, International Movies"
s3091,Movie,Blitz Patrollie,Andrew Wessels,South Africa,12/27/2019,2013,TV-MA,102 min,"Action & Adventure, Comedies, International Movies"
s3092,Movie,"El Pepe, a Supreme Life",Emir Kusturica,Argentina,12/27/2019,2018,TV-14,73 min,"Documentaries, International Movies"
s3095,Movie,The App,Elisa Fuksas,Italy,12/26/2019,2019,TV-MA,79 min,"Dramas, Independent Movies, International Movies"
s3097,TV Show,You,Lee Toland Krieger,United States,12/26/2019,2019,TV-MA,2 Seasons,"Crime TV Shows, Romantic TV Shows, TV Dramas"
s3098,Movie,Doom: Annihilation,Tony Giglio,United States,12/25/2019,2019,R,97 min,"Action & Adventure, Horror Movies, Sci-Fi & Fantasy"
s3099,Movie,Fireworks,"Akiyuki Shinbo, Nobuyuki Takeuchi",Japan,12/25/2019,2017,TV-PG,91 min,"Anime Features, Romantic Movies"
s3100,Movie,Grand-Daddy Day Care,Ron Oliver,United States,12/25/2019,2019,PG-13,96 min,"Children & Family Movies, Comedies"
s3101,Movie,Jarhead: Law of Return,Don Michael Paul,Israel,12/25/2019,2019,R,103 min,"Action & Adventure, Dramas"
s3102,Movie,MFKZ,"Shojiro Nishimi, Guillaume Renard",France,12/25/2019,2017,R,95 min,"Action & Adventure, Comedies, International Movies"
s3103,Movie,Sweetheart,J.D. Dillard,United States,12/25/2019,2019,PG-13,83 min,"Horror Movies, Sci-Fi & Fantasy, Thrillers"
s3116,Movie,The First Lady,Omoni Oboli,United Kingdom,12/20/2019,2015,TV-MA,107 min,"Dramas, International Movies"
s3105,Movie,Como caído del cielo,Pepe Bojórquez,Mexico,12/24/2019,2019,TV-14,117 min,"Comedies, International Movies, Music & Musicals"
s3106,Movie,John Mulaney & The Sack Lunch Bunch,Rhys Thomas,United States,12/24/2019,2019,TV-PG,70 min,"Children & Family Movies, Comedies"
s3114,Movie,Falz Experience,Falz,Not Given,12/20/2019,2018,TV-MA,82 min,"International Movies, Music & Musicals"
s3108,Movie,Jacob's Ladder,David M. Rosenthal,United States,12/22/2019,2019,R,90 min,Thrillers
s3110,Movie,Back of the Net,Louise Alston,Australia,12/21/2019,2019,TV-Y,86 min,"Children & Family Movies, Sports Movies"
s3111,Movie,Lost in London,Sunkanmi Adebayo,Nigeria,12/21/2019,2017,TV-PG,86 min,"Comedies, International Movies"
s3113,Movie,Being Mrs Elliot,Omoni Oboli,Nigeria,12/20/2019,2014,TV-14,113 min,"Dramas, International Movies, Romantic Movies"
s3115,Movie,Iyore,Frank Rajah Arase,Nigeria,12/20/2019,2015,TV-PG,141 min,"Dramas, International Movies, Romantic Movies"
s3117,Movie,The Two Popes,Fernando Meirelles,United Kingdom,12/20/2019,2019,PG-13,126 min,Dramas
s3119,Movie,After the Raid,Rodrigo Reyes,United States,12/19/2019,2019,TV-PG,25 min,"Documentaries, International Movies"
s3122,TV Show,Don't F**k with Cats: Hunting an Internet Killer,Mark Lewis,United Kingdom,12/18/2019,2019,TV-MA,1 Season,"Crime TV Shows, Docuseries"
s3124,Movie,Ronny Chieng: Asian Comedian Destroys America!,Sebastian DiNatale,United States,12/17/2019,2019,TV-MA,63 min,Stand-Up Comedy
s3125,Movie,"Sincerely Yours, Dhaka","Nuhash Humayun, Syed Ahmed Shawki, Rahat Rahman, Robiul Alam Robi, Golam Kibria Farooki, Mir Mukarram Hossain, Tanvir Ahsan, Mahmudul Islam, Abdullah Al Noor, Krishnendu Chattopadhyay, Syed Saleh Ahmed Sobhan",Bangladesh,12/16/2019,2018,TV-MA,136 min,"Comedies, Dramas, Independent Movies"
s3126,Movie,The Danish Girl,Tom Hooper,United Kingdom,12/16/2019,2015,R,120 min,"Dramas, Independent Movies, International Movies"
s3127,Movie,Bangistan,Karan Anshuman,India,12/15/2019,2015,TV-14,134 min,"Comedies, Dramas, International Movies"
s3131,TV Show,"Crazy, Lovely, Cool",Obi Emelonye,Nigeria,12/15/2019,2018,TV-MA,1 Season,"International TV Shows, TV Dramas"
s3132,Movie,Dil Chahta Hai,Farhan Akhtar,India,12/15/2019,2001,TV-14,185 min,"Comedies, Dramas, International Movies"
s3133,Movie,Dil Dhadakne Do,Zoya Akhtar,India,12/15/2019,2015,TV-MA,174 min,"Comedies, Dramas, International Movies"
s3134,Movie,Don,Farhan Akhtar,India,12/15/2019,2006,TV-14,169 min,"Action & Adventure, International Movies"
s3135,Movie,Don 2,Farhan Akhtar,India,12/15/2019,2011,TV-14,148 min,"Action & Adventure, International Movies, Music & Musicals"
s3136,Movie,Fukrey,Mrighdeep Singh Lamba,India,12/15/2019,2013,TV-14,135 min,"Action & Adventure, Comedies, Dramas"
s3137,Movie,Game,Abhinay Deo,India,12/15/2019,2011,TV-14,135 min,"International Movies, Thrillers"
s3138,TV Show,Girls und Panzer,Tsutomu Mizushima,Japan,12/15/2019,2012,TV-PG,1 Season,"Anime Series, International TV Shows"
s3140,Movie,Honeymoon Travels Pvt. Ltd.,Reema Kagti,India,12/15/2019,2007,TV-14,119 min,"Comedies, Dramas, International Movies"
s3141,Movie,Isoken,Jadesola Osiberu,Nigeria,12/15/2019,2017,TV-14,98 min,"Comedies, International Movies, Romantic Movies"
s3142,Movie,Karthik Calling Karthik,Vijay Lalwani,India,12/15/2019,2010,TV-14,135 min,"Dramas, International Movies, Thrillers"
s3143,Movie,Lakshya,Farhan Akhtar,India,12/15/2019,2004,TV-PG,185 min,"Action & Adventure, Dramas, International Movies"
s3144,Movie,Luck by Chance,Zoya Akhtar,India,12/15/2019,2009,TV-14,156 min,"Dramas, International Movies, Romantic Movies"
s3145,Movie,Potato Potahto,Shirley Frimpong-Manso,Ghana,12/15/2019,2017,TV-MA,104 min,"Comedies, Dramas, International Movies"
s3146,Movie,Rock On!!,Abhishek Kapoor,India,12/15/2019,2008,TV-14,139 min,"Dramas, International Movies, Music & Musicals"
s3139,Movie,Holy Expectations,Fernando Ayllón,Colombia,12/15/2019,2019,TV-14,89 min,"Children & Family Movies, Comedies, International Movies"
s3148,Movie,Talaash,Reema Kagti,India,12/15/2019,2012,TV-14,140 min,"Dramas, International Movies, Thrillers"
s3157,Movie,Zero Hour,Robert O. Peters,Nigeria,12/13/2019,2018,TV-MA,89 min,"International Movies, Thrillers"
s3150,Movie,Zindagi Na Milegi Dobara,Zoya Akhtar,India,12/15/2019,2011,TV-14,154 min,"Comedies, Dramas, International Movies"
s3151,Movie,6 Underground,Michael Bay,United States,12/13/2019,2019,R,129 min,"Action & Adventure, Dramas"
s3152,Movie,A Trip to Jamaica,Robert O. Peters,Nigeria,12/13/2019,2016,TV-MA,99 min,"Comedies, International Movies"
s3153,Movie,My Wife and I,Bunmi Ajakaiye,South Africa,12/13/2019,2017,TV-MA,100 min,"Comedies, International Movies, Romantic Movies"
s3154,Movie,Okafor's Law,Omoni Oboli,Nigeria,12/13/2019,2016,TV-14,110 min,"Comedies, International Movies, Romantic Movies"
s3156,Movie,The 9th Precinct,Ding-Lin Wang,Taiwan,12/13/2019,2019,TV-MA,95 min,"International Movies, Thrillers"
s3176,TV Show,The Confession Killer,"Robert Kenner, Taki Oldham",United States,12/6/2019,2019,TV-14,1 Season,"Crime TV Shows, Docuseries"
s3155,Movie,Seven and a half dates,Biodun Stephen,Not Given,12/13/2019,2018,TV-14,107 min,"Dramas, International Movies, Romantic Movies"
s3158,Movie,Jack Whitehall: Christmas with My Father,Richard van't Riet,United Kingdom,12/12/2019,2019,TV-MA,65 min,Stand-Up Comedy
s3159,Movie,The Sky Is Pink,Shonali Bose,India,12/11/2019,2019,TV-MA,143 min,"Dramas, International Movies"
s3160,Movie,Good and Prosperous,Sameh Abdulaziz,Egypt,12/10/2019,2017,TV-14,101 min,"Comedies, International Movies"
s3161,Movie,Michelle Wolf: Joke Show,Lance Bangs,United States,12/10/2019,2019,TV-MA,60 min,Stand-Up Comedy
s3162,Movie,A Family Reunion Christmas,Robbie Countryman,United States,12/9/2019,2019,TV-PG,29 min,"Children & Family Movies, Comedies"
s3163,Movie,It Comes at Night,Trey Edward Shults,United States,12/9/2019,2017,R,92 min,"Horror Movies, Independent Movies"
s3164,Movie,Saaho,Sujeeth,India,12/8/2019,2019,TV-14,172 min,"Action & Adventure, International Movies"
s3165,Movie,Nothing to Lose 2,Alexandre Avancini,Brazil,12/7/2019,2019,PG-13,97 min,"Dramas, Faith & Spirituality, International Movies"
s3167,Movie,Banana Island Ghost,BB Sasore,Nigeria,12/6/2019,2017,TV-14,108 min,"Comedies, International Movies"
s3168,Movie,Celebrity Marriage,Pascal Amanfo,Not Given,12/6/2019,2017,TV-14,107 min,"Dramas, International Movies"
s3170,Movie,Marriage Story,Noah Baumbach,United Kingdom,12/6/2019,2019,R,137 min,Dramas
s3171,Movie,No Game No Life: Zero,Atsuko Ishizuka,Japan,12/6/2019,2017,TV-MA,106 min,"Action & Adventure, Anime Features, International Movies"
s3172,Movie,Slow Country,Eric Aghimien,Nigeria,12/6/2019,2017,TV-MA,115 min,"Dramas, International Movies"
s3175,TV Show,The Chosen One,Michel Tikhomiroff,Brazil,12/6/2019,2019,TV-MA,2 Seasons,"International TV Shows, TV Dramas, TV Mysteries"
s3179,Movie,Wives on Strike,Omoni Oboli,Nigeria,12/6/2019,2016,TV-14,92 min,"Comedies, Dramas, International Movies"
s3180,Movie,Wives on Strike: The Revolution,Omoni Oboli,United Kingdom,12/6/2019,2017,TV-PG,93 min,"Comedies, Dramas, International Movies"
s3181,Movie,A Christmas Prince: The Royal Baby,John Schultz,United States,12/5/2019,2019,TV-PG,85 min,"Children & Family Movies, Dramas, Romantic Movies"
s3187,Movie,Tiffany Haddish: Black Mitzvah,Linda Mendoza,United States,12/3/2019,2019,TV-MA,56 min,Stand-Up Comedy
s3189,Movie,A Cinderella Story: Christmas Wish,Michelle Johnston,United States,12/1/2019,2019,PG,86 min,"Children & Family Movies, Comedies, Music & Musicals"
s3190,Movie,Baby Dolls,Vijay Kumar Arora,India,12/1/2019,2019,TV-PG,127 min,"Comedies, International Movies, Romantic Movies"
s3191,Movie,Cut Bank,Matt Shakman,United States,12/1/2019,2014,R,93 min,"Dramas, Thrillers"
s3192,Movie,Dead Kids,Mikhail Red,Philippines,12/1/2019,2019,TV-MA,94 min,"Dramas, International Movies, Thrillers"
s3194,Movie,High End Yaariyan,Pankaj Batra,India,12/1/2019,2019,TV-14,120 min,"Comedies, International Movies, Romantic Movies"
s3195,Movie,Iron Fists and Kung-Fu Kicks,Serge Ou,Australia,12/1/2019,2019,TV-MA,108 min,"Documentaries, International Movies"
s3196,Movie,Jindua,Navaniat Singh,India,12/1/2019,2017,TV-14,135 min,"Dramas, International Movies, Romantic Movies"
s3198,Movie,Mahi NRI,Gaurav Bavdankar,United Kingdom,12/1/2019,2017,TV-14,134 min,"Comedies, Dramas, International Movies"
s3199,Movie,Qismat,Jagdeep Sidhu,India,12/1/2019,2018,TV-PG,137 min,"Dramas, International Movies, Romantic Movies"
s3201,Movie,Tee Shot: Ariya Jutanugarn,Tanawat Aiemjinda,Thailand,12/1/2019,2019,TV-14,103 min,"Children & Family Movies, Dramas, International Movies"
s3202,Movie,Thug Life,Mukesh Vohra,India,12/1/2019,2017,TV-14,133 min,"Comedies, Dramas, International Movies"
s3203,Movie,Wandering Stars,"Syrine Boulanouar, Nekfeu",France,12/1/2019,2019,TV-MA,95 min,"Documentaries, International Movies, Music & Musicals"
s3204,Movie,Why Me?,Tudor Giurgiu,Romania,12/1/2019,2015,TV-MA,126 min,"Dramas, International Movies, Thrillers"
s3206,Movie,Guatemala: Heart of the Mayan World,"Luis Ara, Ignacio Jaunsolo",Uruguay,11/30/2019,2019,TV-G,67 min,"Documentaries, International Movies"
s3207,Movie,The Zoya Factor,Abhishek Sharma,India,11/30/2019,2019,TV-14,135 min,"Comedies, Dramas, International Movies"
s3208,Movie,Atlantics,Mati Diop,France,11/29/2019,2019,TV-14,106 min,"Dramas, Independent Movies, International Movies"
s3210,Movie,Crazy people,Moses Inwang,Nigeria,11/29/2019,2018,TV-MA,107 min,"Comedies, International Movies, Thrillers"
s3211,Movie,I Lost My Body,Jérémy Clapin,France,11/29/2019,2019,TV-MA,81 min,"Dramas, Independent Movies, International Movies"
s3212,Movie,Kalushi: The Story of Solomon Mahlangu,Mandla Dube,South Africa,11/29/2019,2016,TV-MA,107 min,"Dramas, International Movies"
