show_id,type,title,director,country,date_added,release_year,rating,duration,listed_in
s4287,Movie,Prince of Peoria: A Christmas Moose Miracle,Jon Rosenbaum,United States,12/17/2018,2018,TV-G,29 min,"Children & Family Movies, Comedies"
s4288,Movie,Andhadhun,Sriram Raghavan,India,12/16/2018,2018,TV-14,137 min,"Comedies, Dramas, International Movies"
s4290,Movie,Dragons: Dawn of the Dragon Racers,"Elaine Bogan, John Sanford",United States,12/16/2018,2014,TV-PG,27 min,"Children & Family Movies, Comedies"
s4292,Movie,Kill the Messenger,Michael Cuesta,United States,12/16/2018,2014,R,112 min,"Dramas, Thrillers"
s4293,Movie,Maps to the Stars,David Cronenberg,Canada,12/16/2018,2014,R,112 min,"Comedies, Dramas"
s4294,Movie,Springsteen on Broadway,Thom Zimny,United States,12/16/2018,2018,TV-MA,153 min,Music & Musicals
s4295,Movie,The Theory of Everything,James Marsh,United Kingdom,12/16/2018,2014,PG-13,123 min,"Dramas, Romantic Movies"
s4296,Movie,F.R.E.D.I.,Sean Olson,United States,12/15/2018,2018,TV-PG,90 min,"Children & Family Movies, Sci-Fi & Fantasy"
s4298,Movie,Kita Kita,Sigrid Andrea Bernardo,Philippines,12/15/2018,2017,TV-14,84 min,"Comedies, Dramas, International Movies"
s4300,Movie,Once in a Lifetime Sessions with Kasabian,Matt Askem,United States,12/15/2018,2018,TV-MA,79 min,"Documentaries, Music & Musicals"
s4302,Movie,Once in a Lifetime Sessions with Snow Patrol,Matt Askem,United States,12/15/2018,2018,TV-MA,83 min,"Documentaries, Music & Musicals"
s4303,Movie,Sad Hill Unearthed,Guillermo de Oliveira,Spain,12/15/2018,2017,TV-14,83 min,"Documentaries, International Movies"
s4304,Movie,Vanjagar Ulagam,Manoj Beedha,India,12/15/2018,2018,TV-MA,145 min,"Dramas, International Movies, Thrillers"
s4307,Movie,ROMA,Alfonso Cuarón,Mexico,12/14/2018,2018,R,135 min,"Dramas, Independent Movies, International Movies"
s4323,Movie,ReMastered: Who Killed Jam Master Jay?,Brian Oakes,United States,12/7/2018,2018,TV-MA,59 min,"Documentaries, Music & Musicals"
s4326,Movie,RUSSELL BRAND: RE:BIRTH,Chris Howe,United Kingdom,12/4/2018,2018,TV-MA,63 min,Stand-Up Comedy
s4314,Movie,"Out of Many, One","John Hoffman, Nanfu Wang",United States,12/12/2018,2018,TV-PG,35 min,Documentaries
s4315,Movie,Vir Das: Losing It,Marcus Raboy,United States,12/11/2018,2018,TV-MA,68 min,Stand-Up Comedy
s4316,Movie,5 Star Christmas,Marco Risi,Italy,12/7/2018,2018,TV-14,96 min,"Comedies, International Movies"
s4319,Movie,Free Rein: The Twelve Neighs of Christmas,Marek Losey,Not Given,12/7/2018,2018,TV-G,58 min,"Children & Family Movies, Dramas"
s4318,Movie,Dumplin',Anne Fletcher,United States,12/7/2018,2018,PG-13,110 min,"Comedies, Dramas, Independent Movies"
s4320,Movie,Mowgli: Legend of the Jungle,Andy Serkis,United Kingdom,12/7/2018,2018,PG-13,105 min,"Action & Adventure, Children & Family Movies, Dramas"
s4324,Movie,Super Monsters and the Wish Star,Jacob Joice,Not Given,12/7/2018,2018,TV-Y,28 min,Children & Family Movies
s4322,TV Show,Pine Gap,Mat King,Australia,12/7/2018,2018,TV-MA,1 Season,"International TV Shows, TV Dramas"
s4325,Movie,The American Meme,Bert Marcus,United States,12/7/2018,2018,TV-MA,98 min,Documentaries
s4329,Movie,Teefa in Trouble,Ahsan Rahim,Pakistan,12/2/2018,2018,TV-14,155 min,"Action & Adventure, Comedies, International Movies"
s4330,Movie,A Beautiful Life,Andrew Lau Wai-Keung,China,12/1/2018,2011,TV-14,122 min,"Dramas, International Movies, Romantic Movies"
s4331,Movie,Accident,Cheang Pou Soi,Hong Kong,12/1/2018,2009,TV-MA,87 min,"International Movies, Thrillers"
s4332,Movie,"Ayotzinapa, el paso de la tortuga",Enrique García Meza,Mexico,12/1/2018,2018,TV-MA,73 min,"Documentaries, International Movies"
s4333,Movie,Battle,Katarina Launing,Norway,12/1/2018,2018,TV-MA,98 min,"Dramas, International Movies, Romantic Movies"
s4334,Movie,Blind Detective,Johnnie To,Hong Kong,12/1/2018,2013,TV-MA,130 min,"Action & Adventure, Comedies, International Movies"
s4335,Movie,Break Up 100,Lawrence Cheng,Hong Kong,12/1/2018,2014,TV-14,105 min,"Comedies, International Movies, Romantic Movies"
s4336,Movie,Chal Bhaag,Prakash Balwant Saini,India,12/1/2018,2014,TV-14,110 min,"Comedies, Dramas, International Movies"
s4337,Movie,Crossroads: One Two Jaga,Nam Ron,Malaysia,12/1/2018,2018,TV-14,81 min,"Dramas, International Movies"
s4338,Movie,Don't Go Breaking My Heart,Johnnie To,Hong Kong,12/1/2018,2011,TV-PG,115 min,"Comedies, International Movies, Romantic Movies"
s4339,Movie,Don't Go Breaking My Heart 2,Johnnie To,Hong Kong,12/1/2018,2014,TV-14,113 min,"Comedies, International Movies, Romantic Movies"
s4340,Movie,Faraar,Baljit Singh Deo,Australia,12/1/2018,2015,TV-14,146 min,"Action & Adventure, Dramas, International Movies"
s4342,Movie,Helios,"Leung Lok Man, Luk Kim-ching",Hong Kong,12/1/2018,2015,TV-14,118 min,"Action & Adventure, International Movies"
s4343,Movie,Line Walker,Jazz Boon,China,12/1/2018,2016,TV-MA,109 min,"Action & Adventure, Dramas, International Movies"
s4344,Movie,Look for a Star,Andrew Lau Wai-Keung,Hong Kong,12/1/2018,2009,TV-14,117 min,"Comedies, International Movies, Romantic Movies"
s4346,Movie,Once a Gangster,Felix Chong,Hong Kong,12/1/2018,2010,TV-MA,95 min,"Action & Adventure, Comedies, International Movies"
s4347,Movie,Power Paandi,Dhanush,India,12/1/2018,2017,TV-MA,124 min,"Dramas, Independent Movies, International Movies"
s4349,Movie,SDU: Sex Duties Unit,Gary Mak,Hong Kong,12/1/2018,2013,TV-MA,96 min,"Comedies, International Movies"
s4350,Movie,Set Off,Liu Jiang,China,12/1/2018,2008,TV-MA,96 min,"Dramas, International Movies"
s4352,Movie,A Christmas Prince: The Royal Wedding,John Schultz,United States,11/30/2018,2018,TV-PG,93 min,"Children & Family Movies, Dramas, Romantic Movies"
s4353,Movie,Angela's Christmas,Damien O’Connor,Ireland,11/30/2018,2018,TV-Y,30 min,Children & Family Movies
s4355,Movie,El club de los insomnes,"Joseduardo Giordano, Sergio Goyri Jr.",Mexico,11/30/2018,2018,TV-MA,82 min,"Dramas, International Movies"
s4356,Movie,Happy as Lazzaro,Alice Rohrwacher,Italy,11/30/2018,2018,PG-13,127 min,"Dramas, Independent Movies, International Movies"
s4358,Movie,Manto,Nandita Das,India,11/30/2018,2018,TV-MA,114 min,"Dramas, Independent Movies, International Movies"
s4359,Movie,Rajma Chawal,Leena Yadav,India,11/30/2018,2018,TV-MA,119 min,"Comedies, Dramas, International Movies"
s4361,Movie,The World Is Yours,Romain Gavras,France,11/30/2018,2018,TV-MA,101 min,"Action & Adventure, Comedies, International Movies"
s4362,Movie,Time Share,Sebastián Hofmann,Mexico,11/30/2018,2018,TV-MA,96 min,"Dramas, Independent Movies, International Movies"
s4365,Movie,My Little Pony Friendship Is Magic: Best Gift Ever,"Denny Lu, Mike Myhre",United States,11/25/2018,2018,TV-Y,44 min,Children & Family Movies
s4370,Movie,The Christmas Chronicles,Clay Kaytis,United States,11/22/2018,2018,TV-PG,104 min,"Children & Family Movies, Comedies"
s4371,Movie,The Tribe,Fernando Colomo,Spain,11/21/2018,2018,TV-MA,91 min,"Comedies, International Movies"
s4374,Movie,Puppy Star Christmas,Robert Vince,United States,11/20/2018,2018,PG,91 min,"Children & Family Movies, Comedies"
s4375,Movie,Sabrina,Rocky Soraya,Indonesia,11/20/2018,2018,TV-MA,114 min,"Horror Movies, International Movies"
s4376,Movie,Target,Raditya Dika,Indonesia,11/20/2018,2018,TV-14,91 min,"Comedies, Horror Movies, International Movies"
s4378,Movie,Trevor Noah: Son of Patricia,David Paul Meyer,United States,11/20/2018,2018,TV-MA,64 min,Stand-Up Comedy
s4379,Movie,The Pixar Story,Leslie Iwerks,United States,11/18/2018,2007,G,89 min,Documentaries
s4383,Movie,Cam,Daniel Goldhaber,United States,11/16/2018,2018,TV-MA,95 min,"Horror Movies, Independent Movies, Thrillers"
s4384,Movie,Nothing to Hide,Fred Cavayé,France,11/16/2018,2018,TV-MA,94 min,"Comedies, Dramas, International Movies"
s4386,Movie,The Ballad of Buster Scruggs,"Joel Coen, Ethan Coen",United States,11/16/2018,2018,R,133 min,"Comedies, Dramas"
s4389,Movie,Aalorukkam,V C Abhilash,India,11/15/2018,2018,TV-PG,122 min,"Dramas, Independent Movies, International Movies"
s4399,Movie,Loudon Wainwright III: Surviving Twin,Christopher Guest,United States,11/13/2018,2018,TV-14,92 min,Music & Musicals
s4391,Movie,Christmas Wedding Planner,Justin G. Dyck,Canada,11/15/2018,2017,PG,86 min,"Comedies, International Movies, Romantic Movies"
s4392,Movie,Halkaa,Nila Madhab Panda,India,11/15/2018,2018,TV-14,111 min,"Comedies, Dramas, Independent Movies"
s4393,Movie,May the Devil Take You,Timo Tjahjanto,Indonesia,11/15/2018,2018,TV-MA,111 min,"Horror Movies, International Movies"
s4394,Movie,Muzaffarnagar Baaqi Hai,Nakul Singh Sawhney,India,11/15/2018,2015,TV-MA,136 min,"Documentaries, International Movies"
s4395,Movie,Odu Raja Odu,"Nishanth Ravindaran, Jathin Sanker Raj",India,11/15/2018,2018,TV-14,121 min,"Comedies, Independent Movies, International Movies"
s4396,Movie,Savita Damodar Paranjpe,Swapna Waghmare Joshi,India,11/15/2018,2018,TV-14,119 min,"Horror Movies, International Movies"
s4397,Movie,The Giant,"Aitor Arregi, Jon Garaño",Spain,11/15/2018,2017,TV-14,115 min,"Dramas, International Movies"
s4398,Movie,BuyBust,Erik Matti,Philippines,11/13/2018,2018,TV-MA,128 min,"Action & Adventure, International Movies"
s4402,Movie,"All's Well, End's Well (2009)",Vincent Kok,Hong Kong,11/9/2018,2009,TV-14,99 min,"Comedies, International Movies, Romantic Movies"
s4403,Movie,Lommbock,Christian Zübert,Germany,11/9/2018,2017,TV-MA,106 min,"Comedies, International Movies"
s4405,Movie,Outlaw King,David Mackenzie,United Kingdom,11/9/2018,2018,R,122 min,"Action & Adventure, Dramas"
s4412,Movie,Bucket List,Tejas Prabha Vijay Deoskar,India,11/5/2018,2018,TV-14,129 min,"Dramas, International Movies"
s4415,Movie,Ana e Vitória,Matheus Souza,Brazil,11/2/2018,2018,TV-MA,116 min,"Comedies, International Movies, LGBTQ Movies"
s4417,Movie,ReMastered: Tricky Dick & The Man in Black,Sara Dosa,United States,11/2/2018,2018,TV-14,59 min,"Documentaries, Music & Musicals"
s4418,Movie,The Holiday Calendar,Bradley Walsh,United States,11/2/2018,2018,TV-G,95 min,"Dramas, Romantic Movies"
s4419,Movie,The Other Side of the Wind,Orson Welles,France,11/2/2018,2018,R,122 min,"Classic Movies, Dramas, Independent Movies"
s4420,Movie,They’ll Love Me When I’m Dead,Morgan Neville,United States,11/2/2018,2018,TV-MA,98 min,Documentaries
s4421,Movie,Aagey Se Right,Indrajit Nattoji,India,11/1/2018,2009,TV-14,117 min,"Comedies, International Movies, Music & Musicals"
s4422,Movie,Aamir,Raj Kumar Gupta,India,11/1/2018,2008,TV-14,95 min,"International Movies, Thrillers"
s4423,Movie,ABCD 2,Remo D'Souza,India,11/1/2018,2015,TV-14,146 min,"Dramas, International Movies, Music & Musicals"
s4424,Movie,ABCD: Any Body Can Dance,Remo D'Souza,India,11/1/2018,2013,TV-14,136 min,"Dramas, International Movies"
s4425,Movie,Arjun: The Warrior Prince,Arnab Chaudhuri,India,11/1/2018,2011,TV-14,91 min,"Action & Adventure, Dramas, International Movies"
s4426,Movie,Asees,Rana Ranbir,India,11/1/2018,2018,TV-14,123 min,"Dramas, International Movies, Music & Musicals"
s4427,Movie,Barfi!,Anurag Basu,India,11/1/2018,2012,TV-14,144 min,"Comedies, Dramas, International Movies"
s4428,Movie,Chance Pe Dance,Ken Ghosh,India,11/1/2018,2010,TV-14,121 min,"Comedies, Dramas, International Movies"
s4429,Movie,Christmas With A View,Justin G. Dyck,Canada,11/1/2018,2018,TV-PG,91 min,"International Movies, Romantic Movies"
s4430,Movie,Chup Chup Ke,"Priyadarshan, Kookie V. Gulati",India,11/1/2018,2006,TV-14,158 min,"Comedies, Dramas, International Movies"
s4432,Movie,Dhan Dhana Dhan Goal,Vivek Agnihotri,United Kingdom,11/1/2018,2007,TV-14,157 min,"Dramas, International Movies, Music & Musicals"
s4433,Movie,Dhoondte Reh Jaoge,Umesh Shukla,India,11/1/2018,2009,TV-14,124 min,"Comedies, International Movies, Music & Musicals"
s4434,Movie,Do Dooni Chaar,Habib Faisal,India,11/1/2018,2010,TV-PG,106 min,"Comedies, International Movies"
s4435,Movie,Edge of Fear,Bobby Roth,United States,11/1/2018,2018,TV-MA,92 min,"Independent Movies, Thrillers"
s4436,Movie,"Edmilson Filho: Notas, Comedy about Relationships",Halder Gomes,Brazil,11/1/2018,2017,TV-MA,80 min,Stand-Up Comedy
s4438,Movie,Gaddar: the Traitor,Amitoj Mann,India,11/1/2018,2015,TV-14,126 min,"Dramas, International Movies, Thrillers"
s4439,Movie,Ghanchakkar,Raj Kumar Gupta,India,11/1/2018,2013,TV-MA,129 min,"Comedies, International Movies, Thrillers"
s4440,Movie,Grandmaster,B. Unnikrishnan,India,11/1/2018,2012,TV-14,133 min,"International Movies, Thrillers"
s4441,Movie,Hattrick,Milan Luthria,India,11/1/2018,2007,TV-14,109 min,"Comedies, Dramas, International Movies"
s4442,Movie,Heroine,Madhur Bhandarkar,India,11/1/2018,2012,TV-MA,143 min,"Dramas, International Movies"
s4443,Movie,Himmatwala,Sajid Khan,India,11/1/2018,2013,TV-14,140 min,"Action & Adventure, Comedies, International Movies"
s4444,Movie,Husbands in Goa,Saji Surendran,India,11/1/2018,2012,TV-14,150 min,"Comedies, International Movies, Music & Musicals"
s4445,Movie,Jatts in Golmaal,Ksshitij Chaudhary,India,11/1/2018,2013,TV-PG,128 min,"Comedies, International Movies, Music & Musicals"
s4446,Movie,Kai Po Che!,Abhishek Kapoor,India,11/1/2018,2013,TV-MA,120 min,"Dramas, International Movies, Sports Movies"
s4447,Movie,Kalakalappu,Sundar C.,India,11/1/2018,2012,TV-14,154 min,"Comedies, International Movies, Music & Musicals"
s4448,Movie,Katt Williams: The Pimp Chronicles: Pt. 1,Gary Binkow,United States,11/1/2018,2006,TV-MA,45 min,Stand-Up Comedy
s4449,Movie,Katti Batti,Nikhil Advani,India,11/1/2018,2015,TV-14,132 min,"Comedies, Dramas, International Movies"
s4450,Movie,Life in a ... Metro,Anurag Basu,India,11/1/2018,2007,TV-14,126 min,"Dramas, International Movies, Music & Musicals"
s4451,Movie,Marc Maron: Thinky Pain,Lance Bangs,United States,11/1/2018,2013,TV-MA,95 min,Stand-Up Comedy
s4452,Movie,Mumbai Meri Jaan,Nishikant Kamat,India,11/1/2018,2008,TV-MA,135 min,"Dramas, International Movies"
s4453,Movie,Mundeyan Ton Bachke Rahin,Navinder Pal Singh,India,11/1/2018,2014,TV-14,139 min,"Comedies, International Movies, Music & Musicals"
s4454,Movie,No One Killed Jessica,Raj Kumar Gupta,India,11/1/2018,2011,TV-MA,131 min,"Dramas, International Movies"
s4455,Movie,Oye Lucky! Lucky Oye!,Dibakar Banerjee,India,11/1/2018,2008,TV-14,118 min,"Comedies, Dramas, International Movies"
s4456,Movie,Paan Singh Tomar,Tigmanshu Dhulia,India,11/1/2018,2010,TV-14,129 min,"Action & Adventure, Dramas, International Movies"
s4457,Movie,Raja Natwarlal,Kunal Deshmukh,India,11/1/2018,2014,TV-14,131 min,"Dramas, International Movies, Thrillers"
s4458,Movie,Satyagraha,Prakash Jha,India,11/1/2018,2013,TV-14,146 min,"Dramas, International Movies, Music & Musicals"
s4459,Movie,Settai,R. Kannan,India,11/1/2018,2013,TV-14,123 min,"Comedies, International Movies, Music & Musicals"
s4460,Movie,Sigaram Thodu,Gaurav Narayanan,India,11/1/2018,2014,TV-14,141 min,"Dramas, International Movies, Thrillers"
s4461,Movie,Sommore: The Reign Continues,Kevin Layne,United States,11/1/2018,2015,TV-MA,93 min,Stand-Up Comedy
s4463,Movie,The Untold Tales of Armistead Maupin,Jennifer M. Kroot,United States,11/1/2018,2017,TV-MA,91 min,"Documentaries, LGBTQ Movies"
s4464,Movie,Vaya,Akin Omotoso,South Africa,11/1/2018,2016,TV-MA,106 min,"Dramas, Independent Movies, International Movies"
s4465,Movie,Welcome to Sajjanpur,Shyam Benegal,India,11/1/2018,2008,TV-14,131 min,"Comedies, Dramas, International Movies"
s4467,Movie,Zokkomon,Satyajit Bhatkal,India,11/1/2018,2011,PG,104 min,"Children & Family Movies, Dramas"
s4468,Movie,Gun City,Dani de la Torre,Spain,10/31/2018,2018,TV-MA,126 min,"Dramas, International Movies, Thrillers"
s4469,Movie,Heneral Luna,Jerrold Tarog,Philippines,10/31/2018,2015,R,118 min,"Dramas, International Movies"
s4471,Movie,Dragon Tiger Gate,Wilson Yip,Hong Kong,10/27/2018,2006,TV-14,94 min,"Action & Adventure, International Movies"
s4473,Movie,Dovlatov,Aleksey German,Russia,10/26/2018,2018,PG-13,126 min,"Dramas, International Movies"
s4474,Movie,Jefe,Sergio Barrejón,Spain,10/26/2018,2018,TV-MA,90 min,"Comedies, Dramas, International Movies"
s4476,Movie,Shirkers,Sandi Tan,United States,10/26/2018,2018,TV-14,97 min,Documentaries
s4478,Movie,W/O Ram,Vijay Yelakanti,India,10/26/2018,2018,TV-MA,115 min,"Dramas, International Movies, Thrillers"
s4481,Movie,Ronnie Coleman: The King,Vlad Yudin,United States,10/25/2018,2018,TV-MA,93 min,Documentaries
s4483,Movie,ADAM SANDLER 100% FRESH,Steve Brill,United States,10/23/2018,2018,TV-MA,74 min,Stand-Up Comedy
s4485,Movie,Scorpion King 5: Book of Souls,Don Michael Paul,United States,10/23/2018,2018,PG-13,102 min,"Action & Adventure, Sci-Fi & Fantasy"
s4487,Movie,How to Get Over a Breakup,"Joanna Lombardi, Bruno Ascenzo",Peru,10/20/2018,2018,TV-MA,104 min,"Comedies, International Movies, Romantic Movies"
s4612,Movie,Vettai,N. Linguswamy,India,10/1/2018,2012,TV-14,156 min,"Action & Adventure, International Movies, Music & Musicals"
s4472,Movie,Been So Long,Tinge Krishnan,Not Given,10/26/2018,2018,TV-MA,100 min,"Dramas, International Movies, Music & Musicals"
s4482,Movie,Baahubali: The Beginning (English Version),S.S. Rajamouli,Not Given,10/24/2018,2015,TV-14,138 min,"Action & Adventure, Dramas, International Movies"
s4491,Movie,"Club de Cuervos Presents: I, Potro",Marcos Bucay,Mexico,10/19/2018,2018,TV-MA,51 min,Movies
s4493,Movie,Gnome Alone,Peter Lepeniotis,United Kingdom,10/19/2018,2018,PG,86 min,"Children & Family Movies, Comedies"
s4494,Movie,Illang: The Wolf Brigade,Kim Jee-woon,South Korea,10/19/2018,2018,TV-MA,140 min,"Action & Adventure, International Movies, Sci-Fi & Fantasy"
s4497,Movie,Naa Bangaaru Talli,Rajesh Touchriver,India,10/19/2018,2013,TV-14,122 min,"Dramas, International Movies"
s4500,Movie,S Storm,David Lam,Hong Kong,10/19/2018,2016,TV-MA,95 min,"Action & Adventure, International Movies"
s4501,Movie,The Night Comes for Us,Timo Tjahjanto,Indonesia,10/19/2018,2018,TV-MA,121 min,"Action & Adventure, International Movies"
s4503,Movie,Mr. Chandramouli,Thiru,India,10/18/2018,2018,TV-MA,131 min,"Dramas, International Movies, Thrillers"
s4506,Movie,"Ron White: If You Quit Listening, I'll Shut Up",Tom Forrest,United States,10/16/2018,2018,TV-MA,63 min,Stand-Up Comedy
s4507,Movie,Meghnadbodh Rohoshyo,Anik Datta,India,10/15/2018,2017,TV-MA,150 min,"Dramas, International Movies"
s4508,Movie,Sanju,Rajkumar Hirani,India,10/15/2018,2018,TV-MA,159 min,"Dramas, International Movies"
s4510,Movie,Soorma,Shaad Ali,India,10/13/2018,2018,TV-14,131 min,"Dramas, International Movies, Sports Movies"
s4511,Movie,Apostle,Gareth Evans,United Kingdom,10/12/2018,2018,TV-MA,130 min,"Horror Movies, International Movies, Thrillers"
s4515,TV Show,FIGHTWORLD,Padraic McKinley,Not Given,10/12/2018,2018,TV-MA,1 Season,Docuseries
s4513,Movie,Errementari: The Blacksmith and the Devil,Paul Urkijo Alijo,Spain,10/12/2018,2018,TV-MA,99 min,"Horror Movies, International Movies, Sci-Fi & Fantasy"
s4514,Movie,Feminists: What Were They Thinking?,Johanna Demetrakas,United States,10/12/2018,2018,TV-MA,86 min,"Documentaries, LGBTQ Movies"
s4516,Movie,Kuntilanak,Rizal Mantovani,Indonesia,10/12/2018,2018,TV-14,106 min,"Horror Movies, International Movies"
s4517,Movie,ReMastered: Who Shot the Sheriff,Kief Davidson,United States,10/12/2018,2018,TV-14,57 min,"Documentaries, Music & Musicals"
s4520,Movie,The Kindergarten Teacher,Sara Colangelo,United States,10/12/2018,2018,R,97 min,"Dramas, Independent Movies"
s4523,Movie,22-Jul,Paul Greengrass,Norway,10/10/2018,2018,R,144 min,"Dramas, Thrillers"
s4525,Movie,Tales From the Hood 2,"Rusty Cundieff, Darin Scott",United States,10/10/2018,2018,R,110 min,"Cult Movies, Horror Movies, Independent Movies"
s4526,Movie,Mo Amer: The Vagabond,Stan Lathan,United States,10/9/2018,2018,TV-MA,57 min,Stand-Up Comedy
s4527,Movie,Pulang,Kabir Bhatia,Malaysia,10/8/2018,2018,TV-14,119 min,"Action & Adventure, Dramas, International Movies"
s4529,Movie,Seven in Heaven,Chris Eigeman,United States,10/6/2018,2018,PG-13,94 min,Horror Movies
s4542,Movie,Joe Rogan: Strange Times,Anthony Giordano,United States,10/2/2018,2018,TV-MA,64 min,Stand-Up Comedy
s4533,Movie,Malevolent,Olaf de Fleur,United Kingdom,10/5/2018,2018,TV-MA,89 min,"Horror Movies, Thrillers"
s4534,Movie,Private Life,Tamara Jenkins,United States,10/5/2018,2018,R,124 min,"Comedies, Dramas, Independent Movies"
s4544,Movie,Monty Python Conquers America,Will Yapp,United Kingdom,10/2/2018,2008,TV-MA,55 min,Documentaries
s4538,Movie,The Black Prince,Kavi Raz,United Kingdom,10/3/2018,2017,PG-13,121 min,"Dramas, International Movies"
s4539,Movie,Truth or Dare,Nick Simon,United States,10/3/2018,2017,TV-MA,88 min,Horror Movies
s4540,Movie,Death Race: Beyond Anarchy,Don Michael Paul,United States,10/2/2018,2017,R,111 min,Action & Adventure
s4541,Movie,Eric ldle's What About Dick?,"Eric Idle, Aubrey Powell",United States,10/2/2018,2012,TV-MA,81 min,"Comedies, Music & Musicals"
s4545,Movie,"Monty Python Live (Mostly): One Down, Five to Go",Eric Idle,United Kingdom,10/2/2018,2014,TV-MA,137 min,Comedies
s4546,Movie,Monty Python: Before the Flying Circus,Will Yapp,United Kingdom,10/2/2018,2000,TV-MA,56 min,"Comedies, Documentaries"
s4548,Movie,Monty Python: Live at The Hollywood Bowl,"Terry Hughes, Ian MacNaughton",United Kingdom,10/2/2018,1982,R,80 min,Comedies
s4549,Movie,Monty Python: The Meaning of Live,"Roger Graef, James Rogan",United Kingdom,10/2/2018,2014,TV-MA,94 min,Documentaries
s4565,Movie,Dushman,Shagufta Rafique,Not Given,10/1/2018,2017,TV-14,141 min,"Dramas, International Movies"
s4553,Movie,Monty Python's Life of Brian,Terry Jones,United Kingdom,10/2/2018,1979,R,94 min,"Classic Movies, Comedies, Cult Movies"
s4567,Movie,Freedom at Midnight,Tinu Pappachan,Not Given,10/1/2018,2018,TV-MA,135 min,"Dramas, Independent Movies, International Movies"
s4555,Movie,Parrot Sketch Not Included: Twenty Years of Monty Python,Ian MacNaughton,United Kingdom,10/2/2018,1989,TV-14,72 min,Comedies
s4556,Movie,The Meaning of Monty Python,Albert Sharpe,United Kingdom,10/2/2018,2013,TV-MA,60 min,Documentaries
s4557,Movie,25 Kille,Simranjit Singh Hundal,India,10/1/2018,2016,TV-14,140 min,"Action & Adventure, Dramas, International Movies"
s4558,Movie,A Witches' Ball,Justin G. Dyck,Canada,10/1/2018,2017,PG,91 min,Children & Family Movies
s4559,Movie,Agyaat,Ram Gopal Varma,India,10/1/2018,2009,TV-14,97 min,"Horror Movies, International Movies"
s4560,Movie,Anjaan,N. Linguswamy,India,10/1/2018,2014,TV-14,146 min,"Action & Adventure, Dramas, International Movies"
s4561,Movie,Bathinda Express,Deep Joshi,India,10/1/2018,2016,TV-14,118 min,"Dramas, International Movies, Sports Movies"
s4562,Movie,Delhi 6,Rakeysh Omprakash Mehra,India,10/1/2018,2009,TV-14,128 min,"Dramas, International Movies"
s4563,Movie,Dev.D,Anurag Kashyap,India,10/1/2018,2009,TV-MA,137 min,"Dramas, International Movies, Romantic Movies"
s4564,Movie,Dil Vil Pyaar Vyaar,Manjeet Maan,India,10/1/2018,2014,TV-PG,145 min,"International Movies, Music & Musicals, Romantic Movies"
s4566,Movie,Ek Main Aur Ekk Tu,Shakun Batra,India,10/1/2018,2012,TV-14,106 min,"Comedies, International Movies, Romantic Movies"
s4568,Movie,Haani,Amitoj Mann,India,10/1/2018,2013,TV-14,137 min,"Dramas, International Movies, Music & Musicals"
s4569,Movie,Happy Go Lucky,Amarpreet G S Chabbra,India,10/1/2018,2014,TV-14,129 min,"Comedies, International Movies, Music & Musicals"
s4570,Movie,Harishchandrachi Factory,Paresh Mokashi,India,10/1/2018,2009,TV-PG,99 min,"Dramas, International Movies"
s4571,TV Show,Hot Date,Not Given,United States,10/1/2018,2018,TV-MA,1 Season,"Romantic TV Shows, TV Comedies"
s4572,Movie,Jagga Jasoos,Anurag Basu,India,10/1/2018,2017,TV-14,155 min,"Action & Adventure, Comedies, International Movies"
s4573,Movie,Jatt James Bond,Rohit Jugraj,India,10/1/2018,2014,TV-14,142 min,"Comedies, Dramas, International Movies"
s4574,Movie,Jodhaa Akbar,Ashutosh Gowariker,India,10/1/2018,2008,TV-14,214 min,"Action & Adventure, Dramas, International Movies"
s4575,Movie,Judge Singh LLB,Atharv Baluja,India,10/1/2018,2015,TV-PG,137 min,"Comedies, Dramas, International Movies"
s4576,Movie,Kaminey,Vishal Bhardwaj,India,10/1/2018,2009,TV-14,128 min,"Dramas, International Movies, Music & Musicals"
s4577,Movie,Khido Khundi,Rohit Jugraj,India,10/1/2018,2018,TV-14,151 min,"Dramas, International Movies, Sports Movies"
s4578,Movie,Khoobsurat,Shashanka Ghosh,India,10/1/2018,2014,TV-14,121 min,"Comedies, International Movies, Romantic Movies"
s4579,Movie,Kisaan,Puneet Sira,India,10/1/2018,2009,TV-14,101 min,"Action & Adventure, Dramas, International Movies"
s4580,Movie,Kismat Konnection,Aziz Mirza,India,10/1/2018,2008,TV-14,145 min,"Comedies, Dramas, International Movies"
s4581,Movie,Kurbaan,Renzil D'Silva,India,10/1/2018,2009,TV-14,147 min,"International Movies, Thrillers"
s4582,Movie,Lock,Smeep Kang,India,10/1/2018,2016,TV-14,90 min,"Dramas, International Movies"
s4583,Movie,Luv Shuv Tey Chicken Khurana,Sameer Sharma,India,10/1/2018,2012,TV-14,129 min,"Comedies, International Movies, Romantic Movies"
s4584,Movie,"Main, Meri Patni Aur Woh",Chandan Arora,India,10/1/2018,2005,TV-PG,129 min,"Comedies, Dramas, International Movies"
s4585,Movie,Manje Bistre,Baljit Singh Deo,India,10/1/2018,2017,TV-14,136 min,"Comedies, Dramas, International Movies"
s4586,Movie,Motor Mitraan Di,Amitoj Mann,India,10/1/2018,2016,TV-PG,117 min,"Comedies, International Movies"
s4587,Movie,Mugamoodi,Mysskin,India,10/1/2018,2012,TV-14,150 min,"Action & Adventure, International Movies"
s4588,Movie,Muran,Rajan Madhav,India,10/1/2018,2011,TV-14,134 min,"Action & Adventure, International Movies"
s4589,Movie,My Friend Pinto,Raaghav Dar,India,10/1/2018,2011,TV-14,100 min,"Comedies, International Movies, Sci-Fi & Fantasy"
s4590,Movie,My Little Pony Equestria Girls: Forgotten Friendship,Ishi Rudell,United States,10/1/2018,2018,TV-Y,44 min,Children & Family Movies
